{"schema_version":"0.2.0","id":"first-codex-slice","version":"1.0.0","status":"released","title":"First scored Codex slice","description":"The immutable one-task suite for the initial end-to-end Codex smoke.","tasks":[{"id":"python-text-report","version":"1.0.0","spec_path":"tasks/python-text-report/1.0.0/task.json","spec_digest":"sha256:3bc159f802d518e0dd948a84f0cf4ca21aa09d3dc4add6dd8c62b3261c0ac075","weight":1,"anchor":true}]}
